<?xml version="1.0" encoding="UTF-8"?>

<GCMApplication
	xmlns="http://www-sop.inria.fr/oasis/ProActive/schemas/ApplicationDescriptorSchema"
	xmlns:xsi="http://www.w3.org/2001/XMLSchema-instance"
	xsi:schemaLocation="http://www-sop.inria.fr/oasis/ProActive/schemas/ApplicationDescriptorSchema ../../../../../Extra/org/objectweb/proactive/extra/gcmdeployment/schema/ApplicationDescriptorSchema.xsd">

	<application>
		<executable>
			<resourceProvider refid="INRIA_LAN" />
			<command name="true" />
		</executable>
	</application>

	<resources>
		<resourceProvider id="INRIA_LAN">
			<file path="../deployment/deployment0.xml" />
		</resourceProvider>
	</resources>

</GCMApplication>
